{
  "dry_run": true,
  "external_api_calls": 0,
  "generated_at": "dry-run-deterministic",
  "harness_version": "1.0",
  "iterations_per_scenario": 24,
  "scenarios": [
    {
      "data_classification": "synthetic_no_phi_no_biometrics_no_customer_data",
      "mode": "dry_run",
      "notes": "Synthetic non-PHI timing sample for clinical turn-taking validation.",
      "provider_stack": "native_realtime_omni",
      "samples": [
        {
          "component_timings": {
            "endpointing_ms": 229,
            "native_model_first_audio_ms": 573
          },
          "fallback_used": false,
          "latency_ms": 802,
          "provider_error": false,
          "sample_id": 1,
          "success": true
        },
        {
          "component_timings": {
            "endpointing_ms": 169,
            "native_model_first_audio_ms": 528
          },
          "fallback_used": false,
          "latency_ms": 697,
          "provider_error": false,
          "sample_id": 2,
          "success": true
        },
        {
          "component_timings": {
            "endpointing_ms": 161,
            "native_model_first_audio_ms": 447
          },
          "fallback_used": false,
          "latency_ms": 608,
          "provider_error": false,
          "sample_id": 3,
          "success": true
        },
        {
          "component_timings": {
            "endpointing_ms": 301,
            "native_model_first_audio_ms": 794
          },
          "fallback_used": false,
          "latency_ms": 1095,
          "provider_error": false,
          "sample_id": 4,
          "success": true
        },
        {
          "component_timings": {
            "endpointing_ms": 106,
            "native_model_first_audio_ms": 298
          },
          "fallback_used": false,
          "latency_ms": 404,
          "provider_error": false,
          "sample_id": 5,
          "success": true
        },
        {
          "component_timings": {
            "endpointing_ms": 177,
            "native_model_first_audio_ms": 423
          },
          "fallback_used": false,
          "latency_ms": 600,
          "provider_error": false,
          "sample_id": 6,
          "success": true
        },
        {
          "component_timings": {
            "endpointing_ms": 95,
            "native_model_first_audio_ms": 269
          },
          "fallback_used": false,
          "latency_ms": 364,
          "provider_error": false,
          "sample_id": 7,
          "success": true
        },
        {
          "component_timings": {
            "endpointing_ms": 186,
            "native_model_first_audio_ms": 492
          },
          "fallback_used": false,
          "latency_ms": 678,
          "provider_error": false,
          "sample_id": 8,
          "success": true
        },
        {
          "component_timings": {
            "endpointing_ms": 185,
            "native_model_first_audio_ms": 375
          },
          "fallback_used": false,
          "latency_ms": 560,
          "provider_error": false,
          "sample_id": 9,
          "success": true
        },
        {
          "component_timings": {
            "endpointing_ms": 139,
            "native_model_first_audio_ms": 402
          },
          "fallback_used": false,
          "latency_ms": 541,
          "provider_error": false,
          "sample_id": 10,
          "success": true
        },
        {
          "component_timings": {
            "endpointing_ms": 180,
            "native_model_first_audio_ms": 459
          },
          "fallback_used": false,
          "latency_ms": 639,
          "provider_error": false,
          "sample_id": 11,
          "success": true
        },
        {
          "component_timings": {
            "endpointing_ms": 198,
            "native_model_first_audio_ms": 662
          },
          "fallback_used": false,
          "latency_ms": 860,
          "provider_error": false,
          "sample_id": 12,
          "success": true
        },
        {
          "component_timings": {
            "endpointing_ms": 158,
            "native_model_first_audio_ms": 456
          },
          "fallback_used": false,
          "latency_ms": 614,
          "provider_error": false,
          "sample_id": 13,
          "success": true
        },
        {
          "component_timings": {
            "endpointing_ms": 129,
            "native_model_first_audio_ms": 296
          },
          "fallback_used": false,
          "latency_ms": 425,
          "provider_error": false,
          "sample_id": 14,
          "success": true
        },
        {
          "component_timings": {
            "endpointing_ms": 51,
            "native_model_first_audio_ms": 122
          },
          "fallback_used": false,
          "latency_ms": 173,
          "provider_error": false,
          "sample_id": 15,
          "success": true
        },
        {
          "component_timings": {
            "endpointing_ms": 168,
            "native_model_first_audio_ms": 413
          },
          "fallback_used": false,
          "latency_ms": 581,
          "provider_error": false,
          "sample_id": 16,
          "success": true
        },
        {
          "component_timings": {
            "endpointing_ms": 147,
            "native_model_first_audio_ms": 347
          },
          "fallback_used": false,
          "latency_ms": 494,
          "provider_error": false,
          "sample_id": 17,
          "success": true
        },
        {
          "component_timings": {
            "endpointing_ms": 126,
            "native_model_first_audio_ms": 295
          },
          "fallback_used": false,
          "latency_ms": 421,
          "provider_error": false,
          "sample_id": 18,
          "success": true
        },
        {
          "component_timings": {
            "endpointing_ms": 115,
            "native_model_first_audio_ms": 312
          },
          "fallback_used": false,
          "latency_ms": 427,
          "provider_error": false,
          "sample_id": 19,
          "success": true
        },
        {
          "component_timings": {
            "endpointing_ms": 40,
            "native_model_first_audio_ms": 108
          },
          "fallback_used": false,
          "latency_ms": 148,
          "provider_error": false,
          "sample_id": 20,
          "success": true
        },
        {
          "component_timings": {
            "endpointing_ms": 167,
            "native_model_first_audio_ms": 405
          },
          "fallback_used": false,
          "latency_ms": 572,
          "provider_error": false,
          "sample_id": 21,
          "success": true
        },
        {
          "component_timings": {
            "endpointing_ms": 216,
            "native_model_first_audio_ms": 432
          },
          "fallback_used": false,
          "latency_ms": 648,
          "provider_error": false,
          "sample_id": 22,
          "success": true
        },
        {
          "component_timings": {
            "endpointing_ms": 240,
            "native_model_first_audio_ms": 518
          },
          "fallback_used": false,
          "latency_ms": 758,
          "provider_error": false,
          "sample_id": 23,
          "success": true
        },
        {
          "component_timings": {
            "endpointing_ms": 263,
            "native_model_first_audio_ms": 518
          },
          "fallback_used": false,
          "latency_ms": 781,
          "provider_error": false,
          "sample_id": 24,
          "success": true
        }
      ],
      "summary": {
        "attempts": 24,
        "error_count": 0,
        "fallback_count": 0,
        "latency_ms": {
          "mean": 578.75,
          "p50": 590.5,
          "p95": 851.3,
          "p95_pass": true,
          "p99": 1040.95,
          "target_p95": 1200
        },
        "success_rate": 1.0,
        "successes": 24
      },
      "vertical": "Healthcare Omni",
      "workflow": "ambient_documentation_turn"
    },
    {
      "data_classification": "synthetic_no_phi_no_biometrics_no_customer_data",
      "mode": "dry_run",
      "notes": "Synthetic cascade timing sample with STT/LLM/TTS component timings.",
      "provider_stack": "streaming_stt_llm_tts_cascade",
      "samples": [
        {
          "component_timings": {
            "endpointing_ms": 281,
            "llm_ms": 405,
            "stt_ms": 190,
            "tts_first_audio_ms": 316
          },
          "fallback_used": false,
          "latency_ms": 1192,
          "provider_error": false,
          "sample_id": 1,
          "success": true
        },
        {
          "component_timings": {
            "endpointing_ms": 298,
            "llm_ms": 382,
            "stt_ms": 294,
            "tts_first_audio_ms": 666
          },
          "fallback_used": false,
          "latency_ms": 1640,
          "provider_error": false,
          "sample_id": 2,
          "success": true
        },
        {
          "component_timings": {
            "endpointing_ms": 228,
            "llm_ms": 279,
            "stt_ms": 112,
            "tts_first_audio_ms": 267
          },
          "fallback_used": false,
          "latency_ms": 886,
          "provider_error": false,
          "sample_id": 3,
          "success": true
        },
        {
          "component_timings": {
            "endpointing_ms": 262,
            "llm_ms": 330,
            "stt_ms": 112,
            "tts_first_audio_ms": 374
          },
          "fallback_used": false,
          "latency_ms": 1078,
          "provider_error": false,
          "sample_id": 4,
          "success": true
        },
        {
          "component_timings": {
            "endpointing_ms": 227,
            "llm_ms": 297,
            "stt_ms": 136,
            "tts_first_audio_ms": 406
          },
          "fallback_used": false,
          "latency_ms": 1066,